id,user_id,title,content,view_count,image_url,category,created_at
1,14,Human public health tonight later.,Ask again network open according. Arrive attack all form method everything magazine much.,104,https://picsum.photos/570/947,NEWS,2026-02-14 14:34:14
2,14,Space task better present music address.,"Coach magazine degree husband around. Able hospital unit size expect recent.
Choice father why often my security arm. Live try most arm meet surface attention attack. Identify walk now often always.",618,https://dummyimage.com/148x19,DISCUSSION,2026-03-09 20:40:33
3,11,Available defense enter value.,"Hard citizen street region particularly. Account stage federal professional voice care break.
Choice example decision garden reach table measure. Town suffer begin interest everybody.",549,https://picsum.photos/19/229,NEWS,2026-02-17 14:24:05
4,14,Along hard need involve among half value.,"Decide economic bill sister this image.
Understand door class son. Thing agent say forward. Soon ten specific environment skin blue. Teach develop staff.",849,https://placekitten.com/889/707,DISCUSSION,2026-02-25 17:12:05
5,1,Paper memory history office effort remember.,"Understand Mrs rest score provide hair attorney.
Finish summer rest feel finally impact I fast. Court professor here security. Past feeling nature a.",46,https://picsum.photos/581/686,EVENT,2026-02-21 20:22:57
6,1,Different current agency each little.,"Increase picture create recent manager during prevent. Throughout team those.
Compare when military anyone eat. Lead soon property write. Fish sense kind spring throughout interview trade knowledge.",875,https://placekitten.com/473/784,EVENT,2026-02-17 21:46:18
7,14,Ask imagine my indeed deal.,"Toward once receive task she herself. Wall fear hope. Mrs same son today major event.
Home protect something. Subject try wonder move. Option production base investment term consider.",464,https://picsum.photos/140/82,DISCUSSION,2026-02-22 10:50:48
8,6,Stuff perform draw list boy.,"Record short cold parent security boy standard. Blue agent find quality when.
Away real physical big significant. South someone not American mouth product attention positive. Support state black.",686,https://dummyimage.com/434x726,DISCUSSION,2026-02-27 19:15:51
9,3,They red everybody act way.,Result major serve real position. Large admit family identify during professional hard.,623,https://dummyimage.com/739x367,EVENT,2026-02-11 16:13:29
10,6,Call animal approach factor want point sell.,"Off light key. Whole education technology box.
Man officer rather charge specific we. Yes budget share paper.",473,https://placekitten.com/929/145,ALERT,2026-02-21 12:41:57
11,18,Skin person product value interesting.,"Positive training step author coach. Organization station TV keep light. Record wall matter management ball.
Same page ago director purpose team.",224,https://dummyimage.com/820x75,DISCUSSION,2026-02-14 21:20:16
12,2,Education break significant ten stay ability.,Including could gun series personal service data. Capital explain thing machine ahead picture son. Financial add impact different.,234,https://dummyimage.com/142x565,NEWS,2026-02-26 20:43:27
13,14,Environment able rise study oil process tend.,Machine forward several help usually thank wonder. Occur do simply analysis seat. History professional star wonder manager already.,67,https://placekitten.com/999/73,EVENT,2026-02-13 17:27:24
14,11,Piece TV young section its.,"Kitchen really tough animal. Fall hear certainly most.
Color bad that people. Marriage on discussion point least. Together let explain.",217,https://placekitten.com/562/16,ALERT,2026-02-12 14:52:53
15,15,Seat strategy total simply discover soon despite couple.,"Pick tough position final. Almost half capital travel force indeed.
Skill theory hand maybe. Store either station loss southern.",146,https://placekitten.com/965/51,DISCUSSION,2026-03-09 10:49:40
16,9,Trip determine as statement travel few.,"Cause watch fight manage. Doctor Mr home he. Industry score choice increase between majority impact.
Real describe know. Talk between rate name within.",551,https://picsum.photos/5/567,DISCUSSION,2026-02-16 19:11:33
17,9,Economy company produce ago address so draw.,Company appear score. Box as large gun order later develop. Analysis situation term miss leader who article look.,408,https://dummyimage.com/440x880,DISCUSSION,2026-02-21 11:57:18
18,5,Fund law indeed believe interview professor.,"Rather listen before be. Benefit school speech news only no. Prove improve them wait institution trouble.
Outside goal official defense prevent.",521,https://picsum.photos/53/547,ALERT,2026-02-19 09:56:26
19,4,Reflect finally fund accept thank.,Attorney scientist will begin most heavy. Game have return since nothing be apply. Senior anyone bank kitchen.,156,https://picsum.photos/881/359,EVENT,2026-02-28 20:42:52
20,9,Region matter street south author technology amount.,"Tv television office of remember individual boy.
Commercial way least ready gun join.
Job hundred bad that second. Four collection member box member.",65,https://placekitten.com/620/562,ALERT,2026-02-13 14:11:09
21,11,Medical financial later arm story baby.,Order his oil west school American training occur. Focus little character artist billion.,541,https://picsum.photos/307/682,DISCUSSION,2026-03-10 16:40:53
22,1,True financial prevent product.,Remember be next poor foreign campaign reflect water. Behavior provide meet adult final week game.,696,https://dummyimage.com/896x89,NEWS,2026-02-28 18:10:49
23,9,Wide particular sell six doctor.,"Whole six tough create question. Worker left example high month whom stage.
Their appear lose he. Represent middle by base. Evening town challenge join. Stage this us increase how.",787,https://dummyimage.com/866x227,DISCUSSION,2026-02-22 09:36:42
24,6,Business draw police performance artist.,Movie place offer responsibility fact ability good number. Professor beat window attack. Name skill medical after them analysis hit.,464,https://placekitten.com/276/129,NEWS,2026-03-04 19:58:34
25,9,Fall analysis current.,"Value middle writer myself education send.
Ground sit tend forward buy. Join hundred keep what fund cost.
Under mind song risk bad own. Nation fly bag produce. Knowledge response coach know language.",995,https://placekitten.com/741/784,EVENT,2026-02-12 16:28:20
26,10,Check last he know baby case happen fire.,"Whether ago control military trial. Energy employee land you.
Customer career available common require young specific. Property remember nearly face feel church.",861,https://dummyimage.com/980x841,EVENT,2026-03-10 10:32:54
27,6,By first avoid letter.,Campaign stop necessary onto should can. Treat area buy check clearly follow remember. Way million exist bad cultural what.,552,https://picsum.photos/58/166,NEWS,2026-03-10 17:43:40
28,1,Prepare short indicate police marriage.,"Face what lot source rate father authority. Citizen indeed less future. Fine responsibility safe team. Candidate have no five letter environment.
Best face his past. While total spend value return.",114,https://placekitten.com/493/440,DISCUSSION,2026-02-27 21:53:36
29,8,Anything manager think.,Mr suggest issue think road. Hand hundred now crime network available. Late near stay perhaps particularly campaign benefit.,59,https://placekitten.com/612/688,EVENT,2026-03-07 17:36:02
30,3,Majority none little admit former body indicate.,"Ago listen whose situation simply officer return on. Modern return simple herself.
Occur red course. Finish charge real improve simple turn.",749,https://picsum.photos/541/991,ALERT,2026-02-22 21:57:23
31,9,Newspaper different win father eye.,"First give value somebody event business quality. Time house generation significant chair among.
Under pretty section degree still even. Receive case past only drug prove most.",784,https://placekitten.com/974/977,EVENT,2026-02-20 10:07:25
32,9,Fly position traditional become off.,"Tree company think. Value already structure small. View while unit theory.
Nothing blue work expect writer.",169,https://picsum.photos/662/508,DISCUSSION,2026-02-23 16:34:39
33,14,Dog send west few reveal activity.,Artist brother fill if maybe. Real police wait happen determine. Long lawyer writer health.,987,https://dummyimage.com/912x113,EVENT,2026-02-16 16:28:01
34,7,Indeed nor next pull final against effort.,"Official and general as yes.
All important shoulder she within position inside. Large true help bag who themselves.
Budget year hotel camera without strong. Without leg rest.",730,https://picsum.photos/914/99,DISCUSSION,2026-02-12 14:16:49
35,12,Keep music senior simply cell year.,"Five our pull fly few century produce. Including every news option same.
Quickly new another general poor high modern recent. Chance heavy senior list support feeling.",448,https://dummyimage.com/390x105,ALERT,2026-02-28 09:10:24
36,1,Owner them could seven right next look thank.,Whatever address view while bring. Trial receive region however dream focus executive. Move grow end mention market better wonder.,346,https://placekitten.com/527/1000,NEWS,2026-03-06 17:19:34
37,9,Collection some college result major true my.,Almost suggest war property share include successful. Attack character despite lay art.,225,https://dummyimage.com/498x462,NEWS,2026-02-14 09:39:58
38,2,Behavior here need.,"Reflect bar suddenly. Not teach believe month amount deep.
Even under range exactly myself probably conference. Administration debate certain star start up. Class drive strong home to.",234,https://dummyimage.com/728x768,NEWS,2026-02-19 08:08:27
39,3,Produce beat peace something require bank child Republican.,"First blood accept final growth especially. Beautiful issue news mention.
Bed never others. Tell activity including single right nice.",526,https://dummyimage.com/1015x400,EVENT,2026-02-15 12:22:21
40,6,Fight we forward per.,Friend spring teacher wind carry fly. Look concern huge five same. Whose site for exactly skill half usually.,552,https://dummyimage.com/620x495,EVENT,2026-02-17 19:19:50
41,19,Smile available wrong look husband media.,Already why reduce speech order trial body. Price great positive and worker. Whom former someone black better develop.,590,https://picsum.photos/713/975,ALERT,2026-03-03 11:14:28
42,14,Five feel special boy support possible quality.,Might necessary former interview left. Picture control price how scene third.,194,https://dummyimage.com/173x274,NEWS,2026-02-16 09:03:34
43,14,Figure consumer really memory industry.,"Himself control player really population yourself never. Eye cost success people tend weight machine.
White measure manager range indeed style. Cold not somebody determine allow different eye.",433,https://picsum.photos/899/240,ALERT,2026-02-20 15:15:59
44,2,Ready technology particular into pattern size spend south.,"Mother others collection without fall of. World quickly believe while size try yeah. Reduce car chair focus.
Majority officer environmental increase later plant. Idea seek reason theory.",689,https://picsum.photos/99/94,NEWS,2026-03-04 08:11:32
45,14,Buy tax kid.,"Dark read car practice city usually.
Pressure economy head tough. Appear personal rise sense.
Region ability live car. Mind knowledge account gas building. Really local director become south billion.",819,https://picsum.photos/177/205,NEWS,2026-02-16 11:13:45
46,9,Role goal investment social easy popular easy over.,Single real summer probably feeling. Parent country hot position six soldier dream. Both matter order month within would. Car team nothing half raise several.,459,https://placekitten.com/850/867,EVENT,2026-03-02 14:25:40
47,11,Policy Mrs check base.,"Tv window choice force only shake power. Financial join well draw.
Under break partner area. Budget remain reduce clearly.",255,https://dummyimage.com/737x113,NEWS,2026-03-10 15:12:39
48,18,Happy effort bill off.,"Scientist able teach activity animal. Him change use tax need trial.
Focus indicate result even back. Budget pull apply development middle animal. Attention let executive suddenly force network.",100,https://placekitten.com/1010/400,NEWS,2026-03-09 18:31:42
49,1,Character usually agency must player.,"Ability price support road billion morning.
Man art young Republican behavior TV. Including time learn security oil measure PM.",992,https://dummyimage.com/216x336,NEWS,2026-03-05 20:44:03
50,6,Image movie who debate final enter.,"Citizen rather step recent. Democrat task chance.
How any federal star community weight. New nearly behind big soldier building article.
Cup hundred rather visit. Old else spend against.",416,https://dummyimage.com/1016x60,ALERT,2026-03-03 15:50:25
51,11,Government traditional every land.,"Pass pay positive. Include nearly article evidence case current this.
Piece soon some writer site. Look sit general not focus establish. Five despite time.",924,https://placekitten.com/114/449,NEWS,2026-03-01 10:17:09
52,11,Very yard community door fish scene.,Agreement red way nor none could write think. My compare also argue own after long. Truth cut candidate response try such.,271,https://picsum.photos/997/649,ALERT,2026-03-09 12:29:30
53,3,Skin development open compare fill read camera rock.,"Surface side nothing consider fish speak. Determine not view cell seat draw word collection. Start prove role from.
Decide really go skin result.
Just information coach increase think goal.",802,https://placekitten.com/190/692,ALERT,2026-03-12 10:41:19
54,6,Relate issue president parent its approach former.,"Recent reveal role enter example down. Hotel near make.
About because station person lose best.
Point with list break. Likely thus enter politics hold he.",991,https://dummyimage.com/972x482,NEWS,2026-02-24 17:55:43
55,2,House take alone number.,Quality per build serious common worker will. Call interest write itself young. Challenge organization floor road southern beautiful news need.,765,https://dummyimage.com/216x206,DISCUSSION,2026-03-08 08:47:56
56,11,There enough pressure occur list common.,"Peace race I how. Real any little environmental head full. Financial successful teach range win.
Feel season similar fly. Painting become kid tree imagine machine.",514,https://dummyimage.com/62x495,EVENT,2026-03-06 08:13:07
57,3,Land whether listen necessary general study else store.,"Agree anyone take sister Democrat. Positive question especially important after.
Treatment positive over across education source figure.",871,https://dummyimage.com/611x221,EVENT,2026-02-13 09:06:59
58,3,Write political technology end represent throughout.,"Change she tonight south sort. Identify floor cause agent market fast trade identify.
Remain occur couple risk develop movement size trade.",882,https://picsum.photos/241/963,EVENT,2026-03-10 14:39:16
59,9,Want author threat matter test high fear approach.,"Yeah garden would throughout. Century television Congress ball forward would finish.
Later decide similar. Share majority shake because pass plant idea.",252,https://placekitten.com/691/888,NEWS,2026-02-16 17:37:00
60,3,You majority seek close trade speech.,"Difference world deep against mean.
Represent society heart policy side perhaps. Yes product president after ready indicate herself natural.",597,https://placekitten.com/1019/406,DISCUSSION,2026-02-20 12:27:56
